[
  {
    "id": "dagger",
    "rulesVersion": "1.0.0",
    "displayName": "Dagger",
    "docPath": "systems/equipment/weapons.md",
    "category": "simple",
    "damage": "1d4",
    "ability": "AGI",
    "skillId": "throwing-weapons",
    "costGp": 2,
    "properties": ["finesse", "light", "thrown"],
    "rangeFt": { "normal": 20, "long": 60 }
  },
  {
    "id": "club",
    "rulesVersion": "1.0.0",
    "displayName": "Club",
    "docPath": "systems/equipment/weapons.md",
    "category": "simple",
    "damage": "1d4",
    "ability": "STR",
    "skillId": "mace-and-flail-expertise",
    "costGp": 1,
    "properties": ["light"]
  },
  {
    "id": "quarterstaff",
    "rulesVersion": "1.0.0",
    "displayName": "Quarterstaff",
    "docPath": "systems/equipment/weapons.md",
    "category": "simple",
    "damage": "1d6",
    "ability": "STR",
    "skillId": "polearm-proficiency",
    "costGp": 2,
    "properties": ["two-hand", "versatile"],
    "versatileDamage": "1d8"
  },
  {
    "id": "sling",
    "rulesVersion": "1.0.0",
    "displayName": "Sling",
    "docPath": "systems/equipment/weapons.md",
    "category": "simple",
    "damage": "1d4",
    "ability": "AGI",
    "skillId": "throwing-weapons",
    "costGp": 1,
    "properties": ["ranged", "loading"],
    "rangeFt": { "normal": 60, "long": 240 }
  },
  {
    "id": "thrown-rock",
    "rulesVersion": "1.0.0",
    "displayName": "Thrown rock",
    "docPath": "systems/equipment/weapons.md",
    "category": "simple",
    "damage": "1d4",
    "ability": "STR",
    "skillId": "throwing-weapons",
    "costGp": 0,
    "properties": ["thrown"],
    "rangeFt": { "normal": 20, "long": 60 },
    "tags": ["improvised"]
  },
  {
    "id": "shortsword",
    "rulesVersion": "1.0.0",
    "displayName": "Shortsword",
    "docPath": "systems/equipment/weapons.md",
    "category": "martial",
    "damage": "1d6",
    "ability": "AGI",
    "skillId": "swordsmanship",
    "costGp": 10,
    "properties": ["finesse", "light"]
  },
  {
    "id": "longsword",
    "rulesVersion": "1.0.0",
    "displayName": "Longsword",
    "docPath": "systems/equipment/weapons.md",
    "category": "martial",
    "damage": "1d8",
    "ability": "STR",
    "skillId": "swordsmanship",
    "costGp": 15,
    "properties": ["versatile"],
    "versatileDamage": "1d10"
  },
  {
    "id": "greataxe",
    "rulesVersion": "1.0.0",
    "displayName": "Greataxe",
    "docPath": "systems/equipment/weapons.md",
    "category": "martial",
    "damage": "1d12",
    "ability": "STR",
    "skillId": "axe-mastery",
    "costGp": 30,
    "properties": ["two-hand"]
  },
  {
    "id": "warhammer",
    "rulesVersion": "1.0.0",
    "displayName": "Warhammer",
    "docPath": "systems/equipment/weapons.md",
    "category": "martial",
    "damage": "1d8",
    "ability": "STR",
    "skillId": "mace-and-flail-expertise",
    "costGp": 12
  },
  {
    "id": "spear",
    "rulesVersion": "1.0.0",
    "displayName": "Spear",
    "docPath": "systems/equipment/weapons.md",
    "category": "martial",
    "damage": "1d6",
    "ability": "STR",
    "skillId": "polearm-proficiency",
    "costGp": 5,
    "properties": ["reach", "thrown", "versatile"],
    "versatileDamage": "1d8",
    "rangeFt": { "normal": 20, "long": 60 }
  },
  {
    "id": "battleaxe",
    "rulesVersion": "1.0.0",
    "displayName": "Battleaxe",
    "docPath": "systems/equipment/weapons.md",
    "category": "martial",
    "damage": "1d8",
    "ability": "STR",
    "skillId": "axe-mastery",
    "costGp": 10,
    "properties": ["versatile"],
    "versatileDamage": "1d10"
  },
  {
    "id": "halberd",
    "rulesVersion": "1.0.0",
    "displayName": "Halberd",
    "docPath": "systems/equipment/weapons.md",
    "category": "martial",
    "damage": "1d10",
    "ability": "STR",
    "skillId": "polearm-proficiency",
    "costGp": 20,
    "properties": ["two-hand", "reach"]
  },
  {
    "id": "shortbow",
    "rulesVersion": "1.0.0",
    "displayName": "Shortbow",
    "docPath": "systems/equipment/weapons.md",
    "category": "ranged",
    "damage": "1d6",
    "ability": "AGI",
    "skillId": "archery",
    "costGp": 25,
    "properties": ["ranged", "two-hand"],
    "rangeFt": { "normal": 80, "long": 320 }
  },
  {
    "id": "longbow",
    "rulesVersion": "1.0.0",
    "displayName": "Longbow",
    "docPath": "systems/equipment/weapons.md",
    "category": "ranged",
    "damage": "1d8",
    "ability": "AGI",
    "skillId": "archery",
    "costGp": 50,
    "properties": ["ranged", "two-hand"],
    "rangeFt": { "normal": 150, "long": 600 }
  },
  {
    "id": "light-crossbow",
    "rulesVersion": "1.0.0",
    "displayName": "Light crossbow",
    "docPath": "systems/equipment/weapons.md",
    "category": "ranged",
    "damage": "1d8",
    "ability": "AGI",
    "skillId": "crossbow-expertise",
    "costGp": 25,
    "properties": ["ranged", "loading", "two-hand"],
    "rangeFt": { "normal": 80, "long": 320 }
  },
  {
    "id": "heavy-crossbow",
    "rulesVersion": "1.0.0",
    "displayName": "Heavy crossbow",
    "docPath": "systems/equipment/weapons.md",
    "category": "ranged",
    "damage": "1d10",
    "ability": "AGI",
    "skillId": "crossbow-expertise",
    "costGp": 50,
    "properties": ["ranged", "loading", "two-hand"],
    "rangeFt": { "normal": 100, "long": 400 }
  },
  {
    "id": "throwing-axe",
    "rulesVersion": "1.0.0",
    "displayName": "Throwing axe",
    "docPath": "systems/equipment/weapons.md",
    "category": "ranged",
    "damage": "1d6",
    "ability": "AGI",
    "skillId": "axe-mastery",
    "costGp": 5,
    "properties": ["thrown"],
    "rangeFt": { "normal": 20, "long": 60 }
  }
]
